{
  "source": "visionpilot",
  "type": "lanes",
  "t_ms": 812345.6,
  "frame": "ego",
  "lanes": [
    {
      "kind": "left",
      "pts": [
        [
          1.0,
          1.7
        ],
        [
          5.0,
          1.7
        ],
        [
          10.0,
          1.68
        ]
      ]
    },
    {
      "kind": "right",
      "pts": [
        [
          1.0,
          -1.7
        ],
        [
          5.0,
          -1.7
        ],
        [
          10.0,
          -1.72
        ]
      ]
    }
  ]
}
